A1: 2001 Regular Season Results

A1: Rank | B1: Player | C1: Amount
A2: =RANK(C2,C$2:C$13,0) -> 1 | B2: DC | C2: 107
A3: =RANK(C3,C$2:C$13,0) -> 2 | B3: JG | C3: 42
A4: =RANK(C4,C$2:C$13,0) -> 3 | B4: CR | C4: 31
A5: =RANK(C5,C$2:C$13,0) -> 4 | B5: CK | C5: 11
A6: =RANK(C6,C$2:C$13,0) -> 4 | B6: GP | C6: 11
A7: =RANK(C7,C$2:C$13,0) -> 6 | B7: JL | C7: -20
A8: =RANK(C8,C$2:C$13,0) -> 6 | B8: JN | C8: -20
A9: =RANK(C9,C$2:C$13,0) -> 6 | B9: RC | C9: -20
A10: =RANK(C10,C$2:C$13,0) -> 6 | B10: RG | C10: -20
A11: =RANK(C11,C$2:C$13,0) -> 6 | B11: TK | C11: -20
A12: =RANK(C12,C$2:C$13,0) -> 11 | B12: BL | C12: -51
A13: =RANK(C13,C$2:C$13,0) -> 11 | B13: KK | C13: -51

A1: Rank | B1: Player | C1: Average | D1: Total
A2: 1 | B2: CR | C2: 85.875 | D2: 1374
A3: 2 | B3: DC | C3: 84.875 | D3: 1358
A4: 3 | B4: CK | C4: 83.6875 | D4: 1339
A5: 4 | B5: JL | C5: 83.5625 | D5: 1337
A6: 5 | B6: JG | C6: 83.3125 | D6: 1333
A7: 6 | B7: GP | C7: 80.25 | D7: 1284
A8: 7 | B8: TK | C8: 80.00 | D8: 1280
A9: 8 | B9: JN | C9: 78.0625 | D9: 1249
A10: 9 | B10: RG | C10: 75.125 | D10: 1202
A11: 10 | B11: RC | C11: 73.4375 | D11: 1175
A12: 11 | B12: BL | C12: 70.4375 | D12: 1127
A13: 12 | B13: KK | C13: 51.625 | D13: 826

A1: 2001 Post Season Results

A1: Rank | B1: Player | C1: Amount
A2: =RANK(C2,C$2:C$13,0) -> 1 | B2: RC | C2: 60
A3: =RANK(C3,C$2:C$13,0) -> 2 | B3: TK | C3: 23.333333333333336
A4: =RANK(C4,C$2:C$13,0) -> 3 | B4: BL | C4: 0
A5: =RANK(C5,C$2:C$13,0) -> 4 | B5: CK | C5: -6.6666666666666661
A6: =RANK(C6,C$2:C$13,0) -> 4 | B6: JN | C6: -6.6666666666666661
A7: =RANK(C7,C$2:C$13,0) -> 6 | B7: CR | C7: -10
A8: =RANK(C8,C$2:C$13,0) -> 6 | B8: DC | C8: -10
A9: =RANK(C9,C$2:C$13,0) -> 6 | B9: GP | C9: -10
A10: =RANK(C10,C$2:C$13,0) -> 6 | B10: JG | C10: -10
A11: =RANK(C11,C$2:C$13,0) -> 6 | B11: JL | C11: -10
A12: =RANK(C12,C$2:C$13,0) -> 6 | B12: KK | C12: -10
A13: =RANK(C13,C$2:C$13,0) -> 6 | B13: RG | C13: -10

A1: Rank | B1: Player | C1: Total
A2: =RANK(C2,C$2:C$13,1) -> 1 | B2: RC | C2: 120
A3: =RANK(C3,C$2:C$13,1) -> 2 | B3: TK | C3: 135
A4: =RANK(C4,C$2:C$13,1) -> 3 | B4: CK | C4: 149
A5: =RANK(C5,C$2:C$13,1) -> 4 | B5: JN | C5: 151
A6: =RANK(C6,C$2:C$13,1) -> 5 | B6: GP | C6: 153
A7: =RANK(C7,C$2:C$13,1) -> 6 | B7: DC | C7: 168
A8: =RANK(C8,C$2:C$13,1) -> 7 | B8: BL | C8: 173
A9: =RANK(C9,C$2:C$13,1) -> 8 | B9: CR | C9: 187
A10: =RANK(C10,C$2:C$13,1) -> 9 | B10: JG | C10: 192
A11: =RANK(C11,C$2:C$13,1) -> 10 | B11: JL | C11: 198
A12: =RANK(C12,C$2:C$13,1) -> 11 | B12: RG | C12: 199
A13: =RANK(C13,C$2:C$13,1) -> 12 | B13: KK | C13: 222