A1: if (navigator.appName.substring(0,8) == "Netscape") document.writeln('<br>'); if (navigator.appName.substring(0,8) == "Netscape") document.writeln('<br>');

A1: 2004 Regular Season Results
A3: Rank | B3: Player | C3: Amount | E3: Rank | F3: Player | G3: Average | H3: Total
A4: =RANK(C3,C$3:C$14,0) -> 1 | B4: CR | C4: 124 | E4: 1 | F4: CR | G4: 93.125 | H4: 1490
A5: =RANK(C4,C$3:C$14,0) -> 2 | B5: JL | C5: 45 | E5: 2 | F5: JL | G5: 91.4375 | H5: 1463
A6: =RANK(C5,C$3:C$14,0) -> 3 | B6: JG | C6: 42 | E6: 3 | F6: CB | G6: 91.375 | H6: 1462
A7: =RANK(C6,C$3:C$14,0) -> 4 | B7: BL | C7: 11 | E7: 4 | F7: BL | G7: 91.0625 | H7: 1457
A8: =RANK(C7,C$3:C$14,0) -> 4 | B8: CK | C8: 11 | E8: 5 | F8: CK | G8: 91.00 | H8: 1456
A9: =RANK(C8,C$3:C$14,0) -> 4 | B9: RG | C9: 11 | E9: 6 | F9: RG | G9: 89.1875 | H9: 1427
A10: =RANK(C9,C$3:C$14,0) -> 7 | B10: CB | C10: -20 | E10: 7 | F10: DC | G10: 86.4375 | H10: 1383
A11: =RANK(C10,C$3:C$14,0) -> 7 | B11: GP | C11: -20 | E11: 8 | F11: JG | G11: 86.00 | H11: 1376
A12: =RANK(C11,C$3:C$14,0) -> 9 | B12: DC | C12: -51 | E12: 9 | F12: GP | G12: 85.625 | H12: 1370
A13: =RANK(C12,C$3:C$14,0) -> 9 | B13: KC | C13: -51 | E13: 10 | F13: RC | G13: 78.50 | H13: 1256
A14: =RANK(C13,C$3:C$14,0) -> 9 | B14: KK | C14: -51 | E14: 11 | F14: KK | G14: 61.9375 | H14: 991
A15: =RANK(C14,C$3:C$14,0) -> 9 | B15: RC | C15: -51 | E15: 12 | F15: KC | G15: 36.4375 | H15: 583

A1: 2004 Post Season Results
A3: Rank | B3: Player | C3: Amount | E3: Rank | F3: Player | G3: Total
A4: =RANK(C3,C$3:C$14,0) -> 1 | B4: KK | C4: 50 | E4: =IF(G3="","",RANK(G3,G$3:G$14,1)) -> 1 | F4: KK | G4: 145
A5: =RANK(C4,C$3:C$14,0) -> 2 | B5: CK | C5: 25 | E5: =IF(G4="","",RANK(G4,G$3:G$14,1)) -> 2 | F5: CK | G5: 182
A6: =RANK(C5,C$3:C$14,0) -> 3 | B6: DC | C6: 0 | E6: =IF(G5="","",RANK(G5,G$3:G$14,1)) -> 3 | F6: BL | G6: 207
A7: =RANK(C6,C$3:C$14,0) -> 3 | B7: RG | C7: 0 | E7: =IF(G6="","",RANK(G6,G$3:G$14,1)) -> 4 | F7: CB | G7: 219
A8: =RANK(C7,C$3:C$14,0) -> 5 | B8: BL | C8: -5 | E8: =IF(G7="","",RANK(G7,G$3:G$14,1)) -> 5 | F8: JL | G8: 239
A9: =RANK(C8,C$3:C$14,0) -> 6 | B9: CB | C9: -10 | E9: =IF(G8="","",RANK(G8,G$3:G$14,1)) -> 6 | F9: RG | G9: 242
A10: =RANK(C9,C$3:C$14,0) -> 6 | B10: CR | C10: -10 | E10: =IF(G9="","",RANK(G9,G$3:G$14,1)) -> 7 | F10: DC | G10: 251
A11: =RANK(C10,C$3:C$14,0) -> 6 | B11: GP | C11: -10 | E11: =IF(G10="","",RANK(G10,G$3:G$14,1)) -> 8 | F11: CR | G11: 285
A12: =RANK(C11,C$3:C$14,0) -> 6 | B12: JG | C12: -10 | E12: =IF(G11="","",RANK(G11,G$3:G$14,1)) -> 9 | F12: GP | G12: 304
A13: =RANK(C12,C$3:C$14,0) -> 6 | B13: JL | C13: -10 | E13: =IF(G12="","",RANK(G12,G$3:G$14,1)) -> 10 | F13: JG | G13: 356
A14: =RANK(C13,C$3:C$14,0) -> 6 | B14: KC | C14: -10 | E14: =IF(G13="","",RANK(G13,G$3:G$14,1)) -> 11 | F14: RC | G14: 445
A15: =RANK(C14,C$3:C$14,0) -> 6 | B15: RC | C15: -10 | E15: =IF(G14="","",RANK(G14,G$3:G$14,1)) ->  | F15: KC