A1: if (navigator.appName.substring(0,8) == "Netscape") document.writeln('<br>'); if (navigator.appName.substring(0,8) == "Netscape") document.writeln('<br>');

A1: 2003 Regular Season Results
A3: Rank | B3: Player | C3: Amount | E3: Rank | F3: Player | G3: Average | H3: Total
A4: =RANK(C3,C$3:C$14,0) -> 1 | B4: BL | C4: 155 | E4: 1 | F4: BL | G4: 93.50 | H4: 1496
A5: =RANK(C4,C$3:C$14,0) -> 2 | B5: CE | C5: 42 | E5: 2 | F5: JL | G5: 91.25 | H5: 1460
A6: =RANK(C5,C$3:C$14,0) -> 3 | B6: JL | C6: 14 | E6: 3 | F6: TK | G6: 89.9375 | H6: 1439
A7: =RANK(C6,C$3:C$14,0) -> 4 | B7: CR | C7: 11 | E7: 4 | F7: DC | G7: 89.8125 | H7: 1437
A8: =RANK(C7,C$3:C$14,0) -> 4 | B8: TK | C8: 11 | E8: 5 | F8: CE | G8: 88.375 | H8: 1414
A9: =RANK(C8,C$3:C$14,0) -> 6 | B9: DC | C9: -20 | E9: 6 | F9: RC | G9: 88.125 | H9: 1410
A10: =RANK(C9,C$3:C$14,0) -> 6 | B10: GP | C10: -20 | E10: 7 | F10: CR | G10: 87.125 | H10: 1394
A11: =RANK(C10,C$3:C$14,0) -> 6 | B11: RC | C11: -20 | E11: 8 | F11: GP | G11: 86.1875 | H11: 1379
A12: =RANK(C11,C$3:C$14,0) -> 6 | B12: RG | C12: -20 | E12: 9 | F12: JG | G12: 79.5625 | H12: 1273
A13: =RANK(C12,C$3:C$14,0) -> 10 | B13: CK | C13: -51 | E13: 10 | F13: CK | G13: 77.125 | H13: 1234
A14: =RANK(C13,C$3:C$14,0) -> 10 | B14: JG | C14: -51 | E14: 11 | F14: RG | G14: 76.6875 | H14: 1227
A15: =RANK(C14,C$3:C$14,0) -> 10 | B15: KK | C15: -51 | E15: 12 | F15: KK | G15: 63.6875 | H15: 1019

A1: 2003 Post Season Results
A3: Rank | B3: Player | C3: Amount | E3: Rank | F3: Player | G3: Total
A4: =RANK(C3,C$3:C$14,0) -> 1 | B4: CK | C4: 80 | E4: =IF(G3="","",RANK(G3,G$3:G$14,1)) -> 1 | F4: CK | G4: 122
A5: =RANK(C4,C$3:C$14,0) -> 2 | B5: BL | C5: 20 | E5: =IF(G4="","",RANK(G4,G$3:G$14,1)) -> 2 | F5: BL | G5: 170
A6: =RANK(C5,C$3:C$14,0) -> 3 | B6: CE | C6: -10 | E6: =IF(G5="","",RANK(G5,G$3:G$14,1)) -> 3 | F6: DC | G6: 213
A7: =RANK(C6,C$3:C$14,0) -> 3 | B7: CR | C7: -10 | E7: =IF(G6="","",RANK(G6,G$3:G$14,1)) -> 4 | F7: JL | G7: 216
A8: =RANK(C7,C$3:C$14,0) -> 3 | B8: DC | C8: -10 | E8: =IF(G7="","",RANK(G7,G$3:G$14,1)) -> 5 | F8: CE | G8: 232
A9: =RANK(C8,C$3:C$14,0) -> 3 | B9: GP | C9: -10 | E9: =IF(G8="","",RANK(G8,G$3:G$14,1)) -> 6 | F9: JG | G9: 252
A10: =RANK(C9,C$3:C$14,0) -> 3 | B10: JG | C10: -10 | E10: =IF(G9="","",RANK(G9,G$3:G$14,1)) -> 7 | F10: TK | G10: 254
A11: =RANK(C10,C$3:C$14,0) -> 3 | B11: JL | C11: -10 | E11: =IF(G10="","",RANK(G10,G$3:G$14,1)) -> 8 | F11: CR | G11: 270
A12: =RANK(C11,C$3:C$14,0) -> 3 | B12: KK | C12: -10 | E12: =IF(G11="","",RANK(G11,G$3:G$14,1)) -> 9 | F12: GP | G12: 290
A13: =RANK(C12,C$3:C$14,0) -> 3 | B13: RC | C13: -10 | E13: =IF(G12="","",RANK(G12,G$3:G$14,1)) -> 10 | F13: KK | G13: 310
A14: =RANK(C13,C$3:C$14,0) -> 3 | B14: RG | C14: -10 | E14: =IF(G13="","",RANK(G13,G$3:G$14,1)) -> 11 | F14: RG | G14: 341
A15: =RANK(C14,C$3:C$14,0) -> 3 | B15: TK | C15: -10 | E15: =IF(G14="","",RANK(G14,G$3:G$14,1)) -> 12 | F15: RC | G15: 405