A1: if (navigator.appName.substring(0,8) == "Netscape") document.writeln('<br>'); if (navigator.appName.substring(0,8) == "Netscape") document.writeln('<br>');

A1: 2005 Regular Season Results
A3: Rank | B3: Player | C3: Amount | E3: Rank | F3: Player | G3: Average | H3: Total
A4: =RANK(C3,C$3:C$14,0) -> 1 | B4: CB | C4: 73 | E4: =RANK(G3,G$3:G$14,0) -> 1 | F4: CK | G4: 95.6875 | H4: 1531
A5: =RANK(C4,C$3:C$14,0) -> 2 | B5: CK | C5: 53.5 | E5: =RANK(G4,G$3:G$14,0) -> 1 | F5: CR | G5: 95.6875 | H5: 1531
A6: =RANK(C5,C$3:C$14,0) -> 3 | B6: GP | C6: 42 | E6: =RANK(G5,G$3:G$14,0) -> 3 | F6: JL | G6: 95.375 | H6: 1526
A7: =RANK(C6,C$3:C$14,0) -> 4 | B7: CR | C7: 22.5 | E7: =RANK(G6,G$3:G$14,0) -> 4 | F7: DC | G7: 93.875 | H7: 1502
A8: =RANK(C7,C$3:C$14,0) -> 5 | B8: BL | C8: 11 | E8: =RANK(G7,G$3:G$14,0) -> 5 | F8: BL | G8: 91.8125 | H8: 1469
A9: =RANK(C8,C$3:C$14,0) -> 5 | B9: RG | C9: 11 | E9: =RANK(G8,G$3:G$14,0) -> 6 | F9: GP | G9: 91.1875 | H9: 1459
A10: =RANK(C9,C$3:C$14,0) -> 7 | B10: DC | C10: -20 | E10: =RANK(G9,G$3:G$14,0) -> 7 | F10: RG | G10: 89.375 | H10: 1430
A11: =RANK(C10,C$3:C$14,0) -> 7 | B11: KK | C11: -20 | E11: =RANK(G10,G$3:G$14,0) -> 8 | F11: CB | G11: 89.1875 | H11: 1427
A12: =RANK(C11,C$3:C$14,0) -> 7 | B12: RC | C12: -20 | E12: =RANK(G11,G$3:G$14,0) -> 9 | F12: KK | G12: 88.5625 | H12: 1417
A13: =RANK(C12,C$3:C$14,0) -> 10 | B13: JG | C13: -51 | E13: =RANK(G12,G$3:G$14,0) -> 10 | F13: RC | G13: 85.0625 | H13: 1361
A14: =RANK(C13,C$3:C$14,0) -> 10 | B14: JL | C14: -51 | E14: =RANK(G13,G$3:G$14,0) -> 11 | F14: JG | G14: 73.625 | H14: 1178
A15: =RANK(C14,C$3:C$14,0) -> 10 | B15: KC | C15: -51 | E15: =RANK(G14,G$3:G$14,0) -> 12 | F15: KC | G15: 39.00 | H15: 624

A1: 2005 Post Season Results
A3: Rank | B3: Player | C3: Amount | E3: Rank | F3: Player | G3: Total
A4: =RANK(C3,C$3:C$14,0) -> 1 | B4: BL | C4: 60 | E4: =IF(G3="","",RANK(G3,G$3:G$14,1)) -> 1 | F4: BL | G4: 150
A5: =RANK(C4,C$3:C$14,0) -> 2 | B5: CB | C5: 15 | E5: =IF(G4="","",RANK(G4,G$3:G$14,1)) -> 2 | F5: CB | G5: 160
A6: =RANK(C5,C$3:C$14,0) -> 3 | B6: JL | C6: 0 | E6: =IF(G5="","",RANK(G5,G$3:G$14,1)) -> 3 | F6: JG | G6: 168
A7: =RANK(C6,C$3:C$14,0) -> 3 | B7: RC | C7: 0 | E7: =IF(G6="","",RANK(G6,G$3:G$14,1)) -> 4 | F7: RG | G7: 201
A8: =RANK(C7,C$3:C$14,0) -> 5 | B8: RG | C8: -5 | E8: =IF(G7="","",RANK(G7,G$3:G$14,1)) -> 5 | F8: CR | G8: 202
A9: =RANK(C8,C$3:C$14,0) -> 6 | B9: CK | C9: -10 | E9: =IF(G8="","",RANK(G8,G$3:G$14,1)) -> 6 | F9: JL | G9: 247
A10: =RANK(C9,C$3:C$14,0) -> 6 | B10: CR | C10: -10 | E10: =IF(G9="","",RANK(G9,G$3:G$14,1)) -> 7 | F10: CK | G10: 262
A11: =RANK(C10,C$3:C$14,0) -> 6 | B11: DC | C11: -10 | E11: =IF(G10="","",RANK(G10,G$3:G$14,1)) -> 8 | F11: RC | G11: 264
A12: =RANK(C11,C$3:C$14,0) -> 6 | B12: GP | C12: -10 | E12: =IF(G11="","",RANK(G11,G$3:G$14,1)) -> 9 | F12: GP | G12: 289
A13: =RANK(C12,C$3:C$14,0) -> 6 | B13: JG | C13: -10 | E13: =IF(G12="","",RANK(G12,G$3:G$14,1)) -> 10 | F13: DC | G13: 365
A14: =RANK(C13,C$3:C$14,0) -> 6 | B14: KC | C14: -10 | E14: =IF(G13="","",RANK(G13,G$3:G$14,1)) -> 11 | F14: KK | G14: 381
A15: =RANK(C14,C$3:C$14,0) -> 6 | B15: KK | C15: -10 | E15: =IF(G14="","",RANK(G14,G$3:G$14,1)) ->  | F15: KC