A1: 1999 Regular Season Results

A1: Rank | B1: Player | C1: Amount
A2: =RANK(C2,C$2:C$13,0) -> 1 | B2: GT | C2: 42
A3: =RANK(C3,C$2:C$13,0) -> 2 | B3: JN | C3: 25
A4: =RANK(C4,C$2:C$13,0) -> 3 | B4: CK | C4: 8
A5: =RANK(C5,C$2:C$13,0) -> 3 | B5: DC | C5: 8
A6: =RANK(C6,C$2:C$13,0) -> 3 | B6: RC | C6: 8
A7: =RANK(C7,C$2:C$13,0) -> 3 | B7: RG | C7: 8
A8: =RANK(C8,C$2:C$13,0) -> 7 | B8: BL | C8: -13
A9: =RANK(C9,C$2:C$13,0) -> 7 | B9: GP | C9: -13
A10: =RANK(C10,C$2:C$13,0) -> 7 | B10: JL | C10: -13
A11: =RANK(C11,C$2:C$13,0) -> 7 | B11: KK | C11: -13
A12: =RANK(C12,C$2:C$13,0) -> 7 | B12: TA | C12: -13
A13: =RANK(C13,C$2:C$13,0) -> 12 | B13: GS | C13: -34

A1: Rank | B1: Player | C1: Average | D1: Total
A2: 1 | B2: GT | C2: 83.1875 | D2: 1331
A3: 2 | B3: JN | C3: 82.6875 | D3: 1323
A4: 3 | B4: JL | C4: 82.25 | D4: 1316
A5: 4 | B5: GS | C5: 82.00 | D5: 1312
A6: 5 | B6: BL | C6: 81.6875 | D6: 1307
A7: 6 | B7: GP | C7: 81.50 | D7: 1304
A8: 7 | B8: TA | C8: 81.25 | D8: 1300
A9: 8 | B9: DC | C9: 81.0625 | D9: 1297
A10: 9 | B10: RC | C10: 77.9375 | D10: 1247
A11: 10 | B11: KK | C11: 74.8125 | D11: 1197
A12: 10 | B12: RG | C12: 74.8125 | D12: 1197
A13: 12 | B13: CK | C13: 49.6875 | D13: 795

A1: 1999 Post Season Results

A1: Rank | B1: Player | C1: Amount
A2: =RANK(C2,C$2:C$13,0) -> 1 | B2: BL | C2: 60
A3: =RANK(C3,C$2:C$13,0) -> 2 | B3: KK | C3: 20
A4: =RANK(C4,C$2:C$13,0) -> 3 | B4: RC | C4: 0
A5: =RANK(C5,C$2:C$13,0) -> 3 | B5: TA | C5: 0
A6: =RANK(C6,C$2:C$13,0) -> 5 | B6: CK | C6: -10
A7: =RANK(C7,C$2:C$13,0) -> 5 | B7: DC | C7: -10
A8: =RANK(C8,C$2:C$13,0) -> 5 | B8: GP | C8: -10
A9: =RANK(C9,C$2:C$13,0) -> 5 | B9: GS | C9: -10
A10: =RANK(C10,C$2:C$13,0) -> 5 | B10: GT | C10: -10
A11: =RANK(C11,C$2:C$13,0) -> 5 | B11: JL | C11: -10
A12: =RANK(C12,C$2:C$13,0) -> 5 | B12: JN | C12: -10
A13: =RANK(C13,C$2:C$13,0) -> 5 | B13: RG | C13: -10

A1: Rank | B1: Player | C1: Total
A2: 1 | B2: BL | C2: 106
A3: 2 | B3: KK | C3: 115
A4: 3 | B4: RC | C4: 123
A5: 4 | B5: CK | C5: 126
A6: 5 | B6: GT | C6: 132
A7: 5 | B7: JN | C7: 132
A8: 7 | B8: GS | C8: 138
A9: 8 | B9: GP | C9: 140
A10: 9 | B10: TA | C10: 146
A11: 10 | B11: JL | C11: 147
A12: 11 | B12: DC | C12: 152
A13: 12 | B13: RG | C13: 186