A1: 2002 Regular Season Results

A1: Rank | B1: Player | C1: Amount
A2: =RANK(C2,C$2:C$13,0) -> 1 | B2: CR | C2: 62
A3: =RANK(C3,C$2:C$13,0) -> 2 | B3: JL | C3: 45
A4: =RANK(C4,C$2:C$13,0) -> 3 | B4: CK | C4: 42
A5: =RANK(C5,C$2:C$13,0) -> 3 | B5: RG | C5: 42
A6: =RANK(C6,C$2:C$13,0) -> 5 | B6: BL | C6: 11
A7: =RANK(C7,C$2:C$13,0) -> 5 | B7: KK | C7: 11
A8: =RANK(C8,C$2:C$13,0) -> 7 | B8: GP | C8: -20
A9: =RANK(C9,C$2:C$13,0) -> 7 | B9: RC | C9: -20
A10: =RANK(C10,C$2:C$13,0) -> 7 | B10: TK | C10: -20
A11: =RANK(C11,C$2:C$13,0) -> 10 | B11: CE | C11: -51
A12: =RANK(C12,C$2:C$13,0) -> 10 | B12: DC | C12: -51
A13: =RANK(C13,C$2:C$13,0) -> 10 | B13: JG | C13: -51

A1: Rank | B1: Player | C1: Average | D1: Total
A2: 1 | B2: CR | C2: 91.9375 | D2: 1471
A3: 2 | B3: JL | C3: 90.875 | D3: 1454
A4: 3 | B4: CK | C4: 90.25 | D4: 1444
A5: 4 | B5: RG | C5: 90.00 | D5: 1440
A6: 5 | B6: GP | C6: 88.25 | D6: 1412
A7: 6 | B7: DC | C7: 86.50 | D7: 1384
A8: 7 | B8: BL | C8: 84.125 | D8: 1346
A9: 8 | B9: TK | C9: 81.125 | D9: 1298
A10: 9 | B10: RC | C10: 81.0625 | D10: 1297
A11: 10 | B11: KK | C11: 69.5625 | D11: 1113
A12: 11 | B12: JG | C12: 67.0625 | D12: 1073
A13: 12 | B13: CE | C13: 51.375 | D13: 822

A1: 2002 Post Season Results

A1: Rank | B1: Player | C1: Amount
A2: =RANK(C2,C$2:C$13,0) -> 1 | B2: KK | C2: 55
A3: =RANK(C3,C$2:C$13,0) -> 2 | B3: RC | C3: 20
A4: =RANK(C4,C$2:C$13,0) -> 3 | B4: CR | C4: 0
A5: =RANK(C5,C$2:C$13,0) -> 3 | B5: GP | C5: 0
A6: =RANK(C6,C$2:C$13,0) -> 5 | B6: JG | C6: -5
A7: =RANK(C7,C$2:C$13,0) -> 6 | B7: BL | C7: -10
A8: =RANK(C8,C$2:C$13,0) -> 6 | B8: CE | C8: -10
A9: =RANK(C9,C$2:C$13,0) -> 6 | B9: CK | C9: -10
A10: =RANK(C10,C$2:C$13,0) -> 6 | B10: DC | C10: -10
A11: =RANK(C11,C$2:C$13,0) -> 6 | B11: JL | C11: -10
A12: =RANK(C12,C$2:C$13,0) -> 6 | B12: RG | C12: -10
A13: =RANK(C13,C$2:C$13,0) -> 6 | B13: TK | C13: -10

A1: Rank | B1: Player | C1: Total
A2: =IF(C2="","",RANK(C2,C$2:C$13,1)) -> 1 | B2: KK | C2: 197
A3: =IF(C3="","",RANK(C3,C$2:C$13,1)) -> 2 | B3: RC | C3: 216
A4: =IF(C4="","",RANK(C4,C$2:C$13,1)) -> 3 | B4: GP | C4: 230
A5: =IF(C5="","",RANK(C5,C$2:C$13,1)) -> 4 | B5: DC | C5: 243
A6: =IF(C6="","",RANK(C6,C$2:C$13,1)) -> 5 | B6: TK | C6: 254
A7: =IF(C7="","",RANK(C7,C$2:C$13,1)) -> 6 | B7: CK | C7: 329
A8: =IF(C8="","",RANK(C8,C$2:C$13,1)) -> 7 | B8: CR | C8: 334
A9: =IF(C9="","",RANK(C9,C$2:C$13,1)) -> 8 | B9: JL | C9: 344
A10: =IF(C10="","",RANK(C10,C$2:C$13,1)) -> 9 | B10: BL | C10: 368
A11: =IF(C11="","",RANK(C11,C$2:C$13,1)) -> 10 | B11: RG | C11: 412
A12: =IF(C12="","",RANK(C12,C$2:C$13,1)) ->  | B12: CE
A13: =IF(C13="","",RANK(C13,C$2:C$13,1)) ->  | B13: JG