A1: if (navigator.appName.substring(0,8) == "Netscape") document.writeln('<br>'); if (navigator.appName.substring(0,8) == "Netscape") document.writeln('<br>');

A1: 2006 Regular Season Results
A3: Rank | B3: Player | C3: Amount | E3: Rank | F3: Player | G3: Average | H3: Total
A4: =RANK(C3,C$3:C$14,0) -> 1 | B4: KK | C4: 73 | E4: =RANK(G3,G$3:G$14,0) -> 1 | F4: JL | G4: 91.1875 | H4: 1459
A5: =RANK(C4,C$3:C$14,0) -> 2 | B5: JG | C5: 42 | E5: =RANK(G4,G$3:G$14,0) -> 2 | F5: DC | G5: 88.4375 | H5: 1415
A6: =RANK(C5,C$3:C$14,0) -> 3 | B6: JL | C6: 31 | E6: =RANK(G5,G$3:G$14,0) -> 3 | F6: CR | G6: 88.3125 | H6: 1413
A7: =RANK(C6,C$3:C$14,0) -> 4 | B7: DC | C7: 14 | E7: =RANK(G6,G$3:G$14,0) -> 4 | F7: GP | G7: 87.8125 | H7: 1405
A8: =RANK(C7,C$3:C$14,0) -> 5 | B8: KC | C8: 11 | E8: =RANK(G7,G$3:G$14,0) -> 5 | F8: RC | G8: 86.8125 | H8: 1389
A9: =RANK(C8,C$3:C$14,0) -> 5 | B9: RC | C9: 11 | E9: =RANK(G8,G$3:G$14,0) -> 6 | F9: JG | G9: 86.75 | H9: 1388
A10: =RANK(C9,C$3:C$14,0) -> 7 | B10: BL | C10: -20 | E10: =RANK(G9,G$3:G$14,0) -> 7 | F10: KK | G10: 86.625 | H10: 1386
A11: =RANK(C10,C$3:C$14,0) -> 7 | B11: CB | C11: -20 | E11: =RANK(G10,G$3:G$14,0) -> 8 | F11: RG | G11: 83.6875 | H11: 1339
A12: =RANK(C11,C$3:C$14,0) -> 7 | B12: CR | C12: -20 | E12: =RANK(G11,G$3:G$14,0) -> 9 | F12: CK | G12: 83.00 | H12: 1328
A13: =RANK(C12,C$3:C$14,0) -> 7 | B13: GP | C13: -20 | E13: =RANK(G12,G$3:G$14,0) -> 10 | F13: BL | G13: 81.625 | H13: 1306
A14: =RANK(C13,C$3:C$14,0) -> 11 | B14: CK | C14: -51 | E14: =RANK(G13,G$3:G$14,0) -> 11 | F14: KC | G14: 64.4375 | H14: 1031
A15: =RANK(C14,C$3:C$14,0) -> 11 | B15: RG | C15: -51 | E15: =RANK(G14,G$3:G$14,0) -> 12 | F15: CB | G15: 61.8125 | H15: 989

A1: 2006 Post Season Results
A3: Rank | B3: Player | C3: Amount | E3: Rank | F3: Player | G3: Total
A4: =RANK(C3,C$3:C$14,0) -> 1 | B4: KC | C4: 60 | E4: =IF(G3="","",RANK(G3,G$3:G$14,1)) -> 1 | F4: KC | G4: 151
A5: =RANK(C4,C$3:C$14,0) -> 2 | B5: JL | C5: 20 | E5: =IF(G4="","",RANK(G4,G$3:G$14,1)) -> 2 | F5: JL | G5: 155
A6: =RANK(C5,C$3:C$14,0) -> 3 | B6: DC | C6: 0 | E6: =IF(G5="","",RANK(G5,G$3:G$14,1)) -> 3 | F6: CB | G6: 164
A7: =RANK(C6,C$3:C$14,0) -> 4 | B7: CB | C7: -5 | E7: =IF(G6="","",RANK(G6,G$3:G$14,1)) -> 4 | F7: DC | G7: 177
A8: =RANK(C7,C$3:C$14,0) -> 4 | B8: GP | C8: -5 | E8: =IF(G7="","",RANK(G7,G$3:G$14,1)) -> 5 | F8: GP | G8: 183
A9: =RANK(C8,C$3:C$14,0) -> 6 | B9: BL | C9: -10 | E9: =IF(G8="","",RANK(G8,G$3:G$14,1)) -> 6 | F9: RG | G9: 199
A10: =RANK(C9,C$3:C$14,0) -> 6 | B10: CK | C10: -10 | E10: =IF(G9="","",RANK(G9,G$3:G$14,1)) -> 7 | F10: CR | G10: 239
A11: =RANK(C10,C$3:C$14,0) -> 6 | B11: CR | C11: -10 | E11: =IF(G10="","",RANK(G10,G$3:G$14,1)) -> 8 | F11: CK | G11: 252
A12: =RANK(C11,C$3:C$14,0) -> 6 | B12: JG | C12: -10 | E12: =IF(G11="","",RANK(G11,G$3:G$14,1)) -> 9 | F12: BL | G12: 307
A13: =RANK(C12,C$3:C$14,0) -> 6 | B13: KK | C13: -10 | E13: =IF(G12="","",RANK(G12,G$3:G$14,1)) -> 10 | F13: KK | G13: 322
A14: =RANK(C13,C$3:C$14,0) -> 6 | B14: RC | C14: -10 | E14: =IF(G13="","",RANK(G13,G$3:G$14,1)) -> 11 | F14: JG | G14: 335
A15: =RANK(C14,C$3:C$14,0) -> 6 | B15: RG | C15: -10 | E15: =IF(G14="","",RANK(G14,G$3:G$14,1)) -> 12 | F15: RC | G15: 394