A1: 1997 Regular Season Standings

A1: Rank | B1: Player | C1: Amount
A2: =RANK(C2,C$2:C$11,0) -> 1 | B2: JB | C2: 68
A3: =RANK(C3,C$2:C$11,0) -> 2 | B3: RC | C3: 51
A4: =RANK(C4,C$2:C$11,0) -> 2 | B4: TR | C4: 51
A5: =RANK(C5,C$2:C$11,0) -> 4 | B5: DC | C5: -17
A6: =RANK(C6,C$2:C$11,0) -> 4 | B6: GS | C6: -17
A7: =RANK(C7,C$2:C$11,0) -> 4 | B7: JL | C7: -17
A8: =RANK(C8,C$2:C$11,0) -> 4 | B8: RG | C8: -17
A9: =RANK(C9,C$2:C$11,0) -> 8 | B9: BL | C9: -34
A10: =RANK(C10,C$2:C$11,0) -> 8 | B10: GP | C10: -34
A11: =RANK(C11,C$2:C$11,0) -> 8 | B11: KK | C11: -34

A1: Rank | B1: Player | C1: Average | D1: Total
A2: =RANK(C2,C$2:C$11,0) -> 1 | B2: JB | C2: 88.5625 | D2: 1417
A3: =RANK(C3,C$2:C$11,0) -> 2 | B3: RC | C3: 84.00 | D3: 1344
A4: =RANK(C4,C$2:C$11,0) -> 3 | B4: GS | C4: 82.1875 | D4: 1315
A5: =RANK(C5,C$2:C$11,0) -> 4 | B5: TR | C5: 81.1875 | D5: 1299
A6: =RANK(C6,C$2:C$11,0) -> 5 | B6: DC | C6: 79.375 | D6: 1270
A7: =RANK(C7,C$2:C$11,0) -> 6 | B7: JL | C7: 79.00 | D7: 1264
A8: =RANK(C8,C$2:C$11,0) -> 7 | B8: BL | C8: 78.75 | D8: 1260
A9: =RANK(C9,C$2:C$11,0) -> 8 | B9: KK | C9: 78.125 | D9: 1250
A10: =RANK(C10,C$2:C$11,0) -> 9 | B10: GP | C10: 77.4375 | D10: 1239
A11: =RANK(C11,C$2:C$11,0) -> 10 | B11: RG | C11: 76.00 | D11: 1216

A1: 1997 Post Season Standings

A1: Rank | B1: Player | C1: Amount
A2: =RANK(C2,C$2:C$10,0) -> 1 | B2: DC | C2: 60
A3: =RANK(C3,C$2:C$10,0) -> 2 | B3: JL | C3: 0
A4: =RANK(C4,C$2:C$10,0) -> 2 | B4: RC | C4: 0
A5: =RANK(C5,C$2:C$10,0) -> 4 | B5: BL | C5: -10
A6: =RANK(C6,C$2:C$10,0) -> 4 | B6: GP | C6: -10
A7: =RANK(C7,C$2:C$10,0) -> 4 | B7: GS | C7: -10
A8: =RANK(C8,C$2:C$10,0) -> 4 | B8: JB | C8: -10
A9: =RANK(C9,C$2:C$10,0) -> 4 | B9: RG | C9: -10
A10: =RANK(C10,C$2:C$10,0) -> 4 | B10: TR | C10: -10

A1: Rank | B1: Player | C1: Total
A2: =RANK(C2,C$2:C$10,1) -> 1 | B2: DC | C2: 52
A3: =RANK(C3,C$2:C$10,1) -> 2 | B3: JL | C3: 76
A4: =RANK(C4,C$2:C$10,1) -> 3 | B4: BL | C4: 82
A5: =RANK(C5,C$2:C$10,1) -> 4 | B5: GS | C5: 89
A6: =RANK(C6,C$2:C$10,1) -> 5 | B6: GP | C6: 105
A7: =RANK(C7,C$2:C$10,1) -> 6 | B7: RG | C7: 106
A8: =RANK(C8,C$2:C$10,1) -> 7 | B8: TR | C8: 112
A9: =RANK(C9,C$2:C$10,1) -> 8 | B9: RC | C9: 115
A10: =RANK(C10,C$2:C$10,1) -> 9 | B10: JB | C10: 153