A1: 1998 Regular Season Standings

A1: Rank | B1: Player | C1: Amount
A2: =RANK(C2,C$2:C$11,0) -> 1 | B2: GP | C2: 51
A3: =RANK(C3,C$2:C$11,0) -> 2 | B3: GS | C3: 25.5
A4: =RANK(C4,C$2:C$11,0) -> 2 | B4: GT | C4: 25.5
A5: =RANK(C5,C$2:C$11,0) -> 4 | B5: RC | C5: 17
A6: =RANK(C6,C$2:C$11,0) -> 5 | B6: BL | C6: 0
A7: =RANK(C7,C$2:C$11,0) -> 6 | B7: DC | C7: -17
A8: =RANK(C8,C$2:C$11,0) -> 6 | B8: JL | C8: -17
A9: =RANK(C9,C$2:C$11,0) -> 6 | B9: RG | C9: -17
A10: =RANK(C10,C$2:C$11,0) -> 9 | B10: JB | C10: -34
A11: =RANK(C11,C$2:C$11,0) -> 9 | B11: KK | C11: -34

A1: Rank | B1: Player | C1: Average | D1: Total
A2: =RANK(C2,C$2:C$11,0) -> 1 | B2: GP | C2: 90.75 | D2: 1452
A3: =RANK(C3,C$2:C$11,0) -> 2 | B3: GS | C3: 90.0625 | D3: 1441
A4: =RANK(C4,C$2:C$11,0) -> 2 | B4: GT | C4: 90.0625 | D4: 1441
A5: =RANK(C5,C$2:C$11,0) -> 4 | B5: BL | C5: 87.625 | D5: 1402
A6: =RANK(C6,C$2:C$11,0) -> 5 | B6: JB | C6: 86.8125 | D6: 1389
A7: =RANK(C7,C$2:C$11,0) -> 6 | B7: JL | C7: 86.50 | D7: 1384
A8: =RANK(C8,C$2:C$11,0) -> 7 | B8: RG | C8: 84.00 | D8: 1344
A9: =RANK(C9,C$2:C$11,0) -> 8 | B9: DC | C9: 83.375 | D9: 1334
A10: =RANK(C10,C$2:C$11,0) -> 9 | B10: RC | C10: 81.50 | D10: 1304
A11: =RANK(C11,C$2:C$11,0) -> 10 | B11: KK | C11: 72.375 | D11: 1158

A1: 1998 Postseason Standings

A1: Rank | B1: Player | C1: Amount
A2: =RANK(C2,C$2:C$10,0) -> 1 | B2: KK | C2: 40
A3: =RANK(C3,C$2:C$10,0) -> 2 | B3: BL | C3: 7.5
A4: =RANK(C4,C$2:C$10,0) -> 3 | B4: JB | C4: 0
A5: =RANK(C5,C$2:C$10,0) -> 4 | B5: DC | C5: -2.5
A6: =RANK(C6,C$2:C$10,0) -> 5 | B6: RC | C6: -7.5
A7: =RANK(C7,C$2:C$10,0) -> 5 | B7: RG | C7: -7.5
A8: =RANK(C8,C$2:C$10,0) -> 7 | B8: GP | C8: -10
A9: =RANK(C9,C$2:C$10,0) -> 7 | B9: GT | C9: -10
A10: =RANK(C10,C$2:C$10,0) -> 7 | B10: JL | C10: -10

A1: Rank | B1: Player | C1: Total
A2: =RANK(C2,C$2:C$10,1) -> 1 | B2: KK | C2: 79
A3: =RANK(C3,C$2:C$10,1) -> 2 | B3: BL | C3: 89
A4: =RANK(C4,C$2:C$10,1) -> 2 | B4: DC | C4: 89
A5: =RANK(C5,C$2:C$10,1) -> 4 | B5: JL | C5: 94
A6: =RANK(C6,C$2:C$10,1) -> 5 | B6: RC | C6: 105
A7: =RANK(C7,C$2:C$10,1) -> 6 | B7: RG | C7: 111
A8: =RANK(C8,C$2:C$10,1) -> 7 | B8: GT | C8: 113
A9: =RANK(C9,C$2:C$10,1) -> 8 | B9: JB | C9: 115
A10: =RANK(C10,C$2:C$10,1) -> 9 | B10: GP | C10: 122