A1: if (navigator.appName.substring(0,8) == "Netscape") document.writeln('<br>'); if (navigator.appName.substring(0,8) == "Netscape") document.writeln('<br>');

A1: 2008 Regular Season Standings
A3: Rank | B3: Player | C3: Amount | E3: Rank | F3: Player | G3: Average | H3: Total
A4: =RANK(C3,C$3:C$14,0) -> 1 | B4: CK | C4: 155 | E4: =RANK(G3,G$3:G$14,0) -> 1 | F4: CK | G4: 97.50 | H4: 1560
A5: =RANK(C4,C$3:C$14,0) -> 2 | B5: KK | C5: 45 | E5: =RANK(G4,G$3:G$14,0) -> 2 | F5: KK | G5: 92.875 | H5: 1486
A6: =RANK(C5,C$3:C$14,0) -> 3 | B6: BK | C6: 11 | E6: =RANK(G5,G$3:G$14,0) -> 3 | F6: JL | G6: 90.8125 | H6: 1453
A7: =RANK(C6,C$3:C$14,0) -> 3 | B7: CP | C7: 11 | E7: =RANK(G6,G$3:G$14,0) -> 4 | F7: CR | G7: 89.375 | H7: 1430
A8: =RANK(C7,C$3:C$14,0) -> 3 | B8: JL | C8: 11 | E8: =RANK(G7,G$3:G$14,0) -> 5 | F8: GP | G8: 87.125 | H8: 1394
A9: =RANK(C8,C$3:C$14,0) -> 6 | B9: CB | C9: -20 | E9: =RANK(G8,G$3:G$14,0) -> 6 | F9: BK | G9: 85.8125 | H9: 1373
A10: =RANK(C9,C$3:C$14,0) -> 6 | B10: DC | C10: -20 | E10: =RANK(G9,G$3:G$14,0) -> 7 | F10: CB | G10: 85.4375 | H10: 1367
A11: =RANK(C10,C$3:C$14,0) -> 6 | B11: JG | C11: -20 | E11: =RANK(G10,G$3:G$14,0) -> 8 | F11: DC | G11: 83.8125 | H11: 1341
A12: =RANK(C11,C$3:C$14,0) -> 6 | B12: KC | C12: -20 | E12: =RANK(G11,G$3:G$14,0) -> 9 | F12: CP | G12: 81.9375 | H12: 1311
A13: =RANK(C12,C$3:C$14,0) -> 10 | B13: CR | C13: -51 | E13: =RANK(G12,G$3:G$14,0) -> 10 | F13: RC | G13: 79.1875 | H13: 1267
A14: =RANK(C13,C$3:C$14,0) -> 10 | B14: GP | C14: -51 | E14: =RANK(G13,G$3:G$14,0) -> 11 | F14: JG | G14: 76.9375 | H14: 1231
A15: =RANK(C14,C$3:C$14,0) -> 10 | B15: RC | C15: -51 | E15: =RANK(G14,G$3:G$14,0) -> 12 | F15: KC | G15: 55.5625 | H15: 889

A1: 2008 Post Season Standings
A3: Rank | B3: Player | C3: Amount | E3: Rank | F3: Player | G3: Total
A4: =RANK(C3,C$3:C$14,0) -> 1 | B4: JL | C4: 60 | E4: =IF(G3="","",RANK(G3,G$3:G$14,1)) -> 1 | F4: JL | G4: 150
A5: =RANK(C4,C$3:C$14,0) -> 2 | B5: JG | C5: 10 | E5: =IF(G4="","",RANK(G4,G$3:G$14,1)) -> 2 | F5: JG | G5: 177
A6: =RANK(C5,C$3:C$14,0) -> 3 | B6: CK | C6: 0 | E6: =IF(G5="","",RANK(G5,G$3:G$14,1)) -> 3 | F6: CP | G6: 191
A7: =RANK(C6,C$3:C$14,0) -> 3 | B7: CR | C7: 0 | E7: =IF(G6="","",RANK(G6,G$3:G$14,1)) -> 4 | F7: KC | G7: 197
A8: =RANK(C7,C$3:C$14,0) -> 3 | B8: RC | C8: 0 | E8: =IF(G7="","",RANK(G7,G$3:G$14,1)) -> 5 | F8: CB | G8: 202
A9: =RANK(C8,C$3:C$14,0) -> 6 | B9: BK | C9: -10 | E9: =IF(G8="","",RANK(G8,G$3:G$14,1)) -> 6 | F9: GP | G9: 213
A10: =RANK(C9,C$3:C$14,0) -> 6 | B10: CB | C10: -10 | E10: =IF(G9="","",RANK(G9,G$3:G$14,1)) -> 7 | F10: RC | G10: 229
A11: =RANK(C10,C$3:C$14,0) -> 6 | B11: CP | C11: -10 | E11: =IF(G10="","",RANK(G10,G$3:G$14,1)) -> 8 | F11: CK | G11: 236
A12: =RANK(C11,C$3:C$14,0) -> 6 | B12: DC | C12: -10 | E12: =IF(G11="","",RANK(G11,G$3:G$14,1)) -> 9 | F12: CR | G12: 244
A13: =RANK(C12,C$3:C$14,0) -> 6 | B13: GP | C13: -10 | E13: =IF(G12="","",RANK(G12,G$3:G$14,1)) -> 10 | F13: DC | G13: 282
A14: =RANK(C13,C$3:C$14,0) -> 6 | B14: KC | C14: -10 | E14: =IF(G13="","",RANK(G13,G$3:G$14,1)) -> 11 | F14: KK | G14: 285
A15: =RANK(C14,C$3:C$14,0) -> 6 | B15: KK | C15: -10 | E15: =IF(G14="","",RANK(G14,G$3:G$14,1)) ->  | F15: BK