A1: 2000 Regular Season Standings

A1: Rank | B1: Player | C1: Amount
A2: =RANK(C2,C$2:C$13,0) -> 1 | B2: BL | C2: 63
A3: =RANK(C3,C$2:C$13,0) -> 2 | B3: GP | C3: 29
A4: =RANK(C4,C$2:C$13,0) -> 3 | B4: CR | C4: 8
A5: =RANK(C5,C$2:C$13,0) -> 3 | B5: DC | C5: 8
A6: =RANK(C6,C$2:C$13,0) -> 3 | B6: JN | C6: 8
A7: =RANK(C7,C$2:C$13,0) -> 6 | B7: JL | C7: 4
A8: =RANK(C8,C$2:C$13,0) -> 7 | B8: KK | C8: -13
A9: =RANK(C9,C$2:C$13,0) -> 7 | B9: MR | C9: -13
A10: =RANK(C10,C$2:C$13,0) -> 7 | B10: RG | C10: -13
A11: =RANK(C11,C$2:C$13,0) -> 7 | B11: RP | C11: -13
A12: =RANK(C12,C$2:C$13,0) -> 11 | B12: CK | C12: -34
A13: =RANK(C13,C$2:C$13,0) -> 11 | B13: TK | C13: -34

A1: Rank | B1: Player | C1: Average | D1: Total
A2: 1 | B2: BL | C2: 83.6875 | D2: 1339
A3: 2 | B3: JL | C3: 82.9375 | D3: 1327
A4: 3 | B4: DC | C4: 82.00 | D4: 1312
A5: 4 | B5: GP | C5: 80.5625 | D5: 1289
A6: 5 | B6: MR | C6: 80.4375 | D6: 1287
A7: 6 | B7: CR | C7: 79.9375 | D7: 1279
A8: 7 | B8: TK | C8: 77.6875 | D8: 1243
A9: 8 | B9: RG | C9: 77.00 | D9: 1232
A10: 9 | B10: JN | C10: 76.8125 | D10: 1229
A11: 10 | B11: RP | C11: 66.125 | D11: 1058
A12: 11 | B12: KK | C12: 65.25 | D12: 1044
A13: 12 | B13: CK | C13: 54.3125 | D13: 869

A1: 2000 Post Season Standings

A1: Rank | B1: Player | C1: Amount
A2: =RANK(C2,C$2:C$13,0) -> 1 | B2: JG | C2: 60
A3: =RANK(C3,C$2:C$13,0) -> 2 | B3: CK | C3: 20
A4: =RANK(C4,C$2:C$13,0) -> 3 | B4: KK | C4: 0
A5: =RANK(C5,C$2:C$13,0) -> 4 | B5: RC | C5: -5
A6: =RANK(C6,C$2:C$13,0) -> 4 | B6: RG | C6: -5
A7: =RANK(C7,C$2:C$13,0) -> 6 | B7: BL | C7: -10
A8: =RANK(C8,C$2:C$13,0) -> 6 | B8: CR | C8: -10
A9: =RANK(C9,C$2:C$13,0) -> 6 | B9: DC | C9: -10
A10: =RANK(C10,C$2:C$13,0) -> 6 | B10: GP | C10: -10
A11: =RANK(C11,C$2:C$13,0) -> 6 | B11: JL | C11: -10
A12: =RANK(C12,C$2:C$13,0) -> 6 | B12: JN | C12: -10
A13: =RANK(C13,C$2:C$13,0) -> 6 | B13: TK | C13: -10

A1: Rank | B1: Player | C1: Total
A2: =RANK(C2,C$2:C$13,1) -> 1 | B2: JG | C2: 173
A3: =RANK(C3,C$2:C$13,1) -> 2 | B3: CK | C3: 189
A4: =RANK(C4,C$2:C$13,1) -> 3 | B4: JN | C4: 195
A5: =RANK(C5,C$2:C$13,1) -> 4 | B5: TK | C5: 196
A6: =RANK(C6,C$2:C$13,1) -> 5 | B6: GP | C6: 200
A7: =RANK(C7,C$2:C$13,1) -> 6 | B7: JL | C7: 213
A8: =RANK(C8,C$2:C$13,1) -> 7 | B8: KK | C8: 240
A9: =RANK(C9,C$2:C$13,1) -> 8 | B9: RG | C9: 246
A10: =RANK(C10,C$2:C$13,1) -> 9 | B10: CR | C10: 248
A11: =RANK(C11,C$2:C$13,1) -> 10 | B11: DC | C11: 262
A12: =RANK(C12,C$2:C$13,1) -> 11 | B12: RC | C12: 343
A13: =RANK(C13,C$2:C$13,1) -> 12 | B13: BL | C13: 351