A1: if (navigator.appName.substring(0,8) == "Netscape") document.writeln('<br>'); if (navigator.appName.substring(0,8) == "Netscape") document.writeln('<br>');

A1: 2007 Regular Season Standings
A3: Rank | B3: Player | C3: Amount | E3: Rank | F3: Player | G3: Average | H3: Total
A4: =RANK(C3,C$3:C$14,0) -> 1 | B4: CR | C4: 42 | E4: =RANK(G3,G$3:G$14,0) -> 1 | F4: GP | G4: 97.5625 | H4: 1561
A5: =RANK(C4,C$3:C$14,0) -> 1 | B5: RC | C5: 42 | E5: =RANK(G4,G$3:G$14,0) -> 2 | F5: JL | G5: 97.3125 | H5: 1557
A6: =RANK(C5,C$3:C$14,0) -> 3 | B6: GP | C6: 31 | E6: =RANK(G5,G$3:G$14,0) -> 3 | F6: CB | G6: 96.50 | H6: 1544
A7: =RANK(C6,C$3:C$14,0) -> 4 | B7: JL | C7: 14 | E7: =RANK(G6,G$3:G$14,0) -> 4 | F7: CR | G7: 96.3125 | H7: 1541
A8: =RANK(C7,C$3:C$14,0) -> 5 | B8: CB | C8: 11 | E8: =RANK(G7,G$3:G$14,0) -> 5 | F8: CK | G8: 96.00 | H8: 1536
A9: =RANK(C8,C$3:C$14,0) -> 5 | B9: KK | C9: 11 | E9: =RANK(G8,G$3:G$14,0) -> 6 | F9: KK | G9: 93.875 | H9: 1502
A10: =RANK(C9,C$3:C$14,0) -> 5 | B10: RG | C10: 11 | E10: =RANK(G9,G$3:G$14,0) -> 7 | F10: RG | G10: 93.375 | H10: 1494
A11: =RANK(C10,C$3:C$14,0) -> 8 | B11: BL | C11: -20 | E11: =RANK(G10,G$3:G$14,0) -> 8 | F11: DC | G11: 92.4375 | H11: 1479
A12: =RANK(C11,C$3:C$14,0) -> 8 | B12: DC | C12: -20 | E12: =RANK(G11,G$3:G$14,0) -> 9 | F12: RC | G12: 91.6875 | H12: 1467
A13: =RANK(C12,C$3:C$14,0) -> 8 | B13: JG | C13: -20 | E13: =RANK(G12,G$3:G$14,0) -> 10 | F13: JG | G13: 84.3125 | H13: 1349
A14: =RANK(C13,C$3:C$14,0) -> 11 | B14: CK | C14: -51 | E14: =RANK(G13,G$3:G$14,0) -> 11 | F14: BL | G14: 80.3125 | H14: 1285
A15: =RANK(C14,C$3:C$14,0) -> 11 | B15: KC | C15: -51 | E15: =RANK(G14,G$3:G$14,0) -> 12 | F15: KC | G15: 34.25 | H15: 548

A1: 2007 Postseason Standings
A3: Rank | B3: Player | C3: Amount | E3: Rank | F3: Player | G3: Total
A4: =RANK(C3,C$3:C$14,0) -> 1 | B4: CK | C4: 60 | E4: =IF(G3="","",RANK(G3,G$3:G$14,1)) -> 1 | F4: CK | G4: 110
A5: =RANK(C4,C$3:C$14,0) -> 2 | B5: CR | C5: 10 | E5: =IF(G4="","",RANK(G4,G$3:G$14,1)) -> 2 | F5: CR | G5: 168
A6: =RANK(C5,C$3:C$14,0) -> 3 | B6: GP | C6: 0 | E6: =IF(G5="","",RANK(G5,G$3:G$14,1)) -> 3 | F6: RC | G6: 178
A7: =RANK(C6,C$3:C$14,0) -> 3 | B7: KC | C7: 0 | E7: =IF(G6="","",RANK(G6,G$3:G$14,1)) -> 4 | F7: JL | G7: 188
A8: =RANK(C7,C$3:C$14,0) -> 3 | B8: RC | C8: 0 | E8: =IF(G7="","",RANK(G7,G$3:G$14,1)) -> 5 | F8: CB | G8: 211
A9: =RANK(C8,C$3:C$14,0) -> 6 | B9: BL | C9: -10 | E9: =IF(G8="","",RANK(G8,G$3:G$14,1)) -> 6 | F9: JG | G9: 218
A10: =RANK(C9,C$3:C$14,0) -> 6 | B10: CB | C10: -10 | E10: =IF(G9="","",RANK(G9,G$3:G$14,1)) -> 7 | F10: RG | G10: 240
A11: =RANK(C10,C$3:C$14,0) -> 6 | B11: DC | C11: -10 | E11: =IF(G10="","",RANK(G10,G$3:G$14,1)) -> 8 | F11: BL | G11: 246
A12: =RANK(C11,C$3:C$14,0) -> 6 | B12: JG | C12: -10 | E12: =IF(G11="","",RANK(G11,G$3:G$14,1)) -> 9 | F12: GP | G12: 260
A13: =RANK(C12,C$3:C$14,0) -> 6 | B13: JL | C13: -10 | E13: =IF(G12="","",RANK(G12,G$3:G$14,1)) -> 10 | F13: DC | G13: 288
A14: =RANK(C13,C$3:C$14,0) -> 6 | B14: KK | C14: -10 | E14: =IF(G13="","",RANK(G13,G$3:G$14,1)) -> 11 | F14: KK | G14: 337
A15: =RANK(C14,C$3:C$14,0) -> 6 | B15: RG | C15: -10 | E15: =IF(G14="","",RANK(G14,G$3:G$14,1)) ->  | F15: KC