A1: if (navigator.appName.substring(0,8) == "Netscape") document.writeln('<br>'); if (navigator.appName.substring(0,8) == "Netscape") document.writeln('<br>');

A1: 2009 Regular Season Standings
A3: Rank | B3: Player | C3: Amount | E3: Rank | F3: Player | G3: Average | H3: Total
A4: =RANK(C3,C$3:C$14,0) -> 1 | B4: RR | C4: 124 | E4: =RANK(G3,G$3:G$14,0) -> 1 | F4: RR | G4: 99.375 | H4: 1590
A5: =RANK(C4,C$3:C$14,0) -> 2 | B5: GP | C5: 45 | E5: =RANK(G4,G$3:G$14,0) -> 2 | F5: GP | G5: 98.9375 | H5: 1583
A6: =RANK(C5,C$3:C$14,0) -> 3 | B6: CK | C6: 42 | E6: =RANK(G5,G$3:G$14,0) -> 3 | F6: CR | G6: 98.25 | H6: 1572
A7: =RANK(C6,C$3:C$14,0) -> 4 | B7: BK | C7: 11 | E7: =RANK(G6,G$3:G$14,0) -> 4 | F7: CK | G7: 98.125 | H7: 1570
A8: =RANK(C7,C$3:C$14,0) -> 4 | B8: CP | C8: 11 | E8: =RANK(G7,G$3:G$14,0) -> 5 | F8: JL | G8: 97.75 | H8: 1564
A9: =RANK(C8,C$3:C$14,0) -> 6 | B9: CB | C9: -20 | E9: =RANK(G8,G$3:G$14,0) -> 6 | F9: CP | G9: 96.5625 | H9: 1545
A10: =RANK(C9,C$3:C$14,0) -> 6 | B10: DC | C10: -20 | E10: =RANK(G9,G$3:G$14,0) -> 7 | F10: KK | G10: 93.875 | H10: 1502
A11: =RANK(C10,C$3:C$14,0) -> 6 | B11: JG | C11: -20 | E11: =RANK(G10,G$3:G$14,0) -> 8 | F11: DC | G11: 93.75 | H11: 1500
A12: =RANK(C11,C$3:C$14,0) -> 6 | B12: JL | C12: -20 | E12: =RANK(G11,G$3:G$14,0) -> 9 | F12: CB | G12: 93.3125 | H12: 1493
A13: =RANK(C12,C$3:C$14,0) -> 10 | B13: CR | C13: -51 | E13: =RANK(G12,G$3:G$14,0) -> 10 | F13: BK | G13: 88.25 | H13: 1412
A14: =RANK(C13,C$3:C$14,0) -> 10 | B14: KK | C14: -51 | E14: =RANK(G13,G$3:G$14,0) -> 11 | F14: JG | G14: 87.5625 | H14: 1401
A15: =RANK(C14,C$3:C$14,0) -> 10 | B15: RC | C15: -51 | E15: =RANK(G14,G$3:G$14,0) -> 12 | F15: RC | G15: 79.3125 | H15: 1269

A1: 2009 Postseason Standings
A3: Rank | B3: Player | C3: Amount | E3: Rank | F3: Player | G3: Total
A4: =RANK(C3,C$3:C$14,0) -> 1 | B4: JG | C4: 65 | E4: =IF(G3="","",RANK(G3,G$3:G$14,1)) -> 1 | F4: JG | G4: 171
A5: =RANK(C4,C$3:C$14,0) -> 2 | B5: BK | C5: 20 | E5: =IF(G4="","",RANK(G4,G$3:G$14,1)) -> 2 | F5: BK | G5: 252
A6: =RANK(C5,C$3:C$14,0) -> 3 | B6: KK | C6: 0 | E6: =IF(G5="","",RANK(G5,G$3:G$14,1)) -> 3 | F6: DC | G6: 253
A7: =RANK(C6,C$3:C$14,0) -> 4 | B7: RR | C7: -5 | E7: =IF(G6="","",RANK(G6,G$3:G$14,1)) -> 3 | F7: KK | G7: 253
A8: =RANK(C7,C$3:C$14,0) -> 5 | B8: CB | C8: -10 | E8: =IF(G7="","",RANK(G7,G$3:G$14,1)) -> 5 | F8: CR | G8: 255
A9: =RANK(C8,C$3:C$14,0) -> 5 | B9: CK | C9: -10 | E9: =IF(G8="","",RANK(G8,G$3:G$14,1)) -> 6 | F9: JL | G9: 284
A10: =RANK(C9,C$3:C$14,0) -> 5 | B10: CP | C10: -10 | E10: =IF(G9="","",RANK(G9,G$3:G$14,1)) -> 7 | F10: RR | G10: 291
A11: =RANK(C10,C$3:C$14,0) -> 5 | B11: CR | C11: -10 | E11: =IF(G10="","",RANK(G10,G$3:G$14,1)) -> 8 | F11: CB | G11: 292
A12: =RANK(C11,C$3:C$14,0) -> 5 | B12: DC | C12: -10 | E12: =IF(G11="","",RANK(G11,G$3:G$14,1)) -> 9 | F12: GP | G12: 320
A13: =RANK(C12,C$3:C$14,0) -> 5 | B13: GP | C13: -10 | E13: =IF(G12="","",RANK(G12,G$3:G$14,1)) -> 10 | F13: RC | G13: 358
A14: =RANK(C13,C$3:C$14,0) -> 5 | B14: JL | C14: -10 | E14: =IF(G13="","",RANK(G13,G$3:G$14,1)) ->  | F14: CK
A15: =RANK(C14,C$3:C$14,0) -> 5 | B15: RC | C15: -10 | E15: =IF(G14="","",RANK(G14,G$3:G$14,1)) ->  | F15: CP